{
    "Format version": 1,
    "Components": {
        "Flight Controller": {
            "Product": {
                "Manufacturer": "ArduPilot,AET,Airvolute,Aocoda-RC-H743Dual,CSKY,GreenSight,Japan Aviation Electronics Industry Ltd.,mRo,ORBITH743,Horizon31,Dheeran labs,Qiotek,Sierra Aerospace,SkySakura",
                "Model": "MatekH743",
                "Version": "V3",
                "URL": "https://www.mateksys.com/?portfolio=h743-slim"
            },
            "Firmware": {
                "Type": "Rover",
                "Version": "4.6.2 official"
            },
            "Specifications": {
                "MCU Series": "STM32H7xx"
            },
            "Notes": ""
        },
        "Frame": {
            "Product": {
                "Manufacturer": "Carisma",
                "Model": "SCA - 1E Coyote",
                "Version": "2.1 - RTR - 1:10",
                "URL": "https://carisma-shop.com/products/sca-1e-coyote-2-1-builders-kit?_pos=8&_sid=e1f767587&_ss=r#"
            },
            "Specifications": {
                "TOW min Kg": 0.5,
                "TOW max Kg": 0.5,
                "Frame class": "Rover"
            },
            "Notes": ""
        },
        "Battery Monitor": {
            "Product": {
                "Manufacturer": "",
                "Model": "",
                "Version": "",
                "URL": ""
            },
            "Firmware": {
                "Type": "",
                "Version": ""
            },
            "FC Connection": {
                "Type": "Analog",
                "Protocol": "Analog Voltage and Current"
            },
            "Notes": ""
        },
        "Battery": {
            "Product": {
                "Manufacturer": "Carisma",
                "Model": "Sports Pack",
                "Version": "",
                "URL": ""
            },
            "Specifications": {
                "Chemistry": "NiMH",
                "Volt per cell max": 1.4,
                "Volt per cell arm": 1.25,
                "Volt per cell low": 1.1167,
                "Volt per cell crit": 1.0917,
                "Volt per cell min": 1.0833,
                "Number of cells": 6,
                "Capacity mAh": 1400
            },
            "Notes": ""
        },
        "ESC": {
            "Product": {
                "Manufacturer": "Carisma",
                "Model": "ARC-1",
                "Version": "",
                "URL": ""
            },
            "Firmware": {
                "Type": "",
                "Version": ""
            },
            "FC->ESC Connection": {
                "Type": "Main Out",
                "Protocol": "Normal"
            },
            "ESC->FC Telemetry": {
                "Type": "None",
                "Protocol": "None"
            },
            "Notes": ""
        },
        "Motors": {
            "Product": {
                "Manufacturer": "Carisma",
                "Model": "",
                "Version": "",
                "URL": ""
            },
            "Specifications": {
                "Poles": 14
            },
            "Notes": "Brushed Motor"
        },
        "Propellers": {
            "Product": {
                "Manufacturer": "",
                "Model": "",
                "Version": "",
                "URL": ""
            },
            "Specifications": {
                "Diameter_inches": 3.0
            },
            "Notes": ""
        },
        "GNSS Receiver": {
            "Product": {
                "Manufacturer": "Holybro",
                "Model": "",
                "Version": "",
                "URL": ""
            },
            "Firmware": {
                "Type": "",
                "Version": ""
            },
            "FC Connection": {
                "Type": "CAN1",
                "Protocol": "DroneCAN"
            },
            "Notes": ""
        },
        "RC Controller": {
            "Product": {
                "Manufacturer": "Radiomaster",
                "Model": "TX16S",
                "Version": "MKI",
                "URL": "https://www.radiomasterrc.com/products/tx16s-mark-ii-radio-controller"
            },
            "Firmware": {
                "Type": "EdgeTx",
                "Version": "2.9.2-providence"
            },
            "Notes": "Yaapu telem included, this is just the controller with the sticks. Some controllers include the RC transmitter, this one does not."
        },
        "RC Transmitter": {
            "Product": {
                "Manufacturer": "TBS",
                "Model": "TRACER Micro TX",
                "Version": "2",
                "URL": "https://www.team-blacksheep.com/products/prod:tbs_tracer_mtx"
            },
            "Firmware": {
                "Type": "Crossfire TX",
                "Version": "4.0.0"
            },
            "Notes": "This RC transmitter piggie-backs on the back of the Radiomaster TX16S"
        },
        "RC Receiver": {
            "Product": {
                "Manufacturer": "TBS",
                "Model": "Tracer Nano RX",
                "Version": "",
                "URL": "https://www.team-blacksheep.com/products/prod:tracer_nanorx"
            },
            "Firmware": {
                "Type": "",
                "Version": ""
            },
            "FC Connection": {
                "Type": "RCin/SBUS",
                "Protocol": "CRSF"
            },
            "Notes": ""
        },
        "Telemetry": {
            "Product": {
                "Manufacturer": "RFDesign",
                "Model": "RFD868x",
                "Version": "EU",
                "URL": "https://store.rfdesign.com.au/rfd868x-eu-modem-bundle-hs-8517-62-00-90/"
            },
            "Firmware": {
                "Type": "",
                "Version": ""
            },
            "FC Connection": {
                "Type": "SERIAL4",
                "Protocol": "MAVLink2"
            },
            "Notes": ""
        }
    },
    "Program version": "4.5.6",
    "Configuration template": "AION_R1"
}
