{
    "Format version": 2,
    "Components": {
        "Flight Controller": {
            "Product": {
                "Manufacturer": "CubePilot",
                "Model": "CubeOrangePlus",
                "Version": "",
                "URL": ""
            },
            "Firmware": {
                "Type": "ArduCopter",
                "Version": "4.5.4 official"
            },
            "Specifications": {
                "MCU Series": "STM32H7xx"
            },
            "Notes": ""
        },
        "Frame": {
            "Product": {
                "Manufacturer": "",
                "Model": "",
                "Version": "",
                "URL": ""
            },
            "Specifications": {
                "TOW min Kg": 1.3,
                "TOW max Kg": 2.0,
                "Frame class": "Quad"
            },
            "Notes": "5\" Props"
        },
        "Battery Monitor": {
            "Product": {
                "Manufacturer": "FETtec",
                "Model": "4in1 ESC 65A",
                "Version": "",
                "URL": "https://fettec.net/en/shop/electronics/esc/fettec-4in1-esc-65a"
            },
            "Firmware": {
                "Type": "FETtec",
                "Version": "10_224"
            },
            "FC Connection": {
                "Type": "other",
                "Protocol": "ESC"
            },
            "Notes": "ESC Telemetry is used as battery monitor"
        },
        "Battery": {
            "Product": {
                "Manufacturer": "",
                "Model": "",
                "Version": "",
                "URL": ""
            },
            "Specifications": {
                "Chemistry": "Lipo",
                "Volt per cell max": 4.2,
                "Volt per cell arm": 3.5833,
                "Volt per cell low": 3.5,
                "Volt per cell crit": 3.2,
                "Volt per cell min": 3.3,
                "Number of cells": 6,
                "Capacity mAh": 5000
            },
            "Notes": ""
        },
        "ESC": {
            "Product": {
                "Manufacturer": "FETtec",
                "Model": "4in1 ESC 65A",
                "Version": "",
                "URL": "https://fettec.net/en/shop/electronics/esc/fettec-4in1-esc-65a"
            },
            "Firmware": {
                "Type": "FETtec",
                "Version": "10_224"
            },
            "FC->ESC Connection": {
                "Type": "SERIAL1",
                "Protocol": "FETtecOneWire"
            },
            "ESC->FC Telemetry": {
                "Type": "SERIAL1",
                "Protocol": "FETtecOneWire"
            },
            "Notes": "Firmware should be > 183"
        },
        "Motors": {
            "Product": {
                "Manufacturer": "T-Motor",
                "Model": "F80",
                "Version": "1900KV",
                "URL": "https://shop.tmotor.com/products/fpv-drones-brushless-motor-f80-pro"
            },
            "Specifications": {
                "Poles": 14
            },
            "Notes": ""
        },
        "Propellers": {
            "Product": {
                "Manufacturer": "HQProp",
                "Model": "5043 5X4.3X3",
                "Version": "V2S",
                "URL": "https://www.hqprop.com/"
            },
            "Specifications": {
                "Diameter_inches": 5
            },
            "Notes": ""
        },
        "GNSS Receiver": {
            "Product": {
                "Manufacturer": "CubePilot",
                "Model": "Here3/Here3+",
                "Version": "3.0",
                "URL": "https://docs.cubepilot.org/user-guides/here-3/here-3-manual"
            },
            "Firmware": {
                "Type": "uBlox",
                "Version": "20.10"
            },
            "FC Connection": {
                "Type": "SERIAL4",
                "Protocol": "uBlox"
            },
            "Notes": "First GNSS receiver is connected to SERIAL4 the second to CAN1"
        },
        "RC Controller": {
            "Product": {
                "Manufacturer": "FrSky",
                "Model": "Taranis Q X7",
                "Version": "",
                "URL": "https://www.frsky-rc.com/product/taranis-q-x7-2/"
            },
            "Firmware": {
                "Type": "OpenTx",
                "Version": ""
            },
            "Notes": ""
        },
        "RC Transmitter": {
            "Product": {
                "Manufacturer": "TBS",
                "Model": "Tracer",
                "Version": "",
                "URL": ""
            },
            "Firmware": {
                "Type": "",
                "Version": ""
            },
            "Notes": ""
        },
        "RC Receiver": {
            "Product": {
                "Manufacturer": "TBS",
                "Model": "Tracer Nano RX",
                "Version": "",
                "URL": "https://www.team-blacksheep.com/products/prod:tracer_nanorx"
            },
            "Firmware": {
                "Type": "",
                "Version": ""
            },
            "FC Connection": {
                "Type": "RCin/SBUS",
                "Protocol": "All"
            },
            "Notes": ""
        },
        "Telemetry": {
            "Product": {
                "Manufacturer": "",
                "Model": "",
                "Version": "",
                "URL": ""
            },
            "Firmware": {
                "Type": "",
                "Version": ""
            },
            "FC Connection": {
                "Type": "SERIAL2",
                "Protocol": "MAVLink2"
            },
            "Notes": ""
        }
    },
    "Program version": "5.0.1",
    "Configuration template": "ReadyToSkyZD550"
}
