{
    "Format version": 1,
    "Components": {
        "Flight Controller": {
            "Product": {
                "Manufacturer": "Hex/ProfiCNC,CubePilot",
                "Model": "CubeOrangePlus",
                "Version": "1.0",
                "URL": "https://docs.cubepilot.org/user-guides/autopilot/the-cube-module-overview"
            },
            "Firmware": {
                "Type": "ArduCopter",
                "Version": "4.6.3 official"
            },
            "Specifications": {
                "MCU Series": "STM32H7xx"
            },
            "Notes": "CubeOrange+ with 94.5mm x 44.3mm x 17.3mm"
        },
        "Frame": {
            "Product": {
                "Manufacturer": "HOVERIT",
                "Model": "BAAZ v2",
                "Version": "v2",
                "URL": "https://hoverit.in/baaz-1"
            },
            "Specifications": {
                "TOW min Kg": 56,
                "TOW max Kg": 90,
                "Frame class": "Quad"
            },
            "Notes": "z50 eft frame"
        },
        "Battery Monitor": {
            "Product": {
                "Manufacturer": "HOBBYWING",
                "Model": "XRotor X13-14S",
                "Version": "",
                "URL": "https://www.hobbywing.com/en/products/xrotorx13"
            },
            "Firmware": {
                "Type": "https://www.hobbywing.com/en/products/datalinkv2273",
                "Version": ""
            },
            "FC Connection": {
                "Type": "other",
                "Protocol": "ESC"
            },
            "Notes": "Voltage and current are monitored via the ESC DatalinkV2."
        },
        "Battery": {
            "Product": {
                "Manufacturer": "HOVERIT",
                "Model": "160Ah",
                "Version": "160ah baaz",
                "URL": "https://hoverit.in/home"
            },
            "Specifications": {
                "Chemistry": "LiIonSS",
                "Volt per cell max": 4.2,
                "Volt per cell arm": 3.9429,
                "Volt per cell low": 3.6,
                "Volt per cell crit": 3.55,
                "Volt per cell min": 3.3,
                "Number of cells": 14,
                "Capacity mAh": 160000
            },
            "Notes": "Normal battery 24kg by mpower india"
        },
        "ESC": {
            "Product": {
                "Manufacturer": "HOBBYWING",
                "Model": "XRotor X13-14S",
                "Version": "https://vi.aliexpress.com/i/1005005384267348.html?gatewayAdapt=glo2vnm",
                "URL": "https://www.hobbywing.com/en/products/xrotorx13"
            },
            "Firmware": {
                "Type": "",
                "Version": ""
            },
            "FC->ESC Connection": {
                "Type": "Main Out",
                "Protocol": "Normal"
            },
            "ESC->FC Telemetry": {
                "Type": "SERIAL2",
                "Protocol": "Scripting"
            },
            "Notes": "https://ardupilot.org/copter/docs/common-hobbywing-dronecan-esc.html"
        },
        "Motors": {
            "Product": {
                "Manufacturer": "HOBBYWING",
                "Model": "XRotor X13-14S",
                "Version": "",
                "URL": "https://www.hobbywing.com/en/products/xrotorx13"
            },
            "Specifications": {
                "Poles": 14
            },
            "Notes": "https://ardupilot.org/copter/docs/common-hobbywing-dronecan-esc.html"
        },
        "Propellers": {
            "Product": {
                "Manufacturer": "HOBBYWING",
                "Model": "56*20''",
                "Version": "",
                "URL": "https://www.amazon.com/HAWEWE-Hobbywing-Plastics-Propeller-Agricultural/dp/B0CH7WLPCG"
            },
            "Specifications": {
                "Diameter_inches": 56
            },
            "Notes": "Hobbywing high-quality propellers"
        },
        "GNSS Receiver": {
            "Product": {
                "Manufacturer": "CubePilot HEX",
                "Model": "com.cubepilot.here4",
                "Version": "1.12",
                "URL": "https://docs.cubepilot.org/user-guides/here-4/here-4-manual"
            },
            "Firmware": {
                "Type": "",
                "Version": "1.12"
            },
            "FC Connection": {
                "Type": "CAN2",
                "Protocol": "DroneCAN"
            },
            "Notes": "RTK GNSS receiver HERE 4"
        },
        "RC Controller": {
            "Product": {
                "Manufacturer": "SIYI",
                "Model": "mk32 RADIO",
                "Version": "1",
                "URL": "https://shop.siyi.biz/products/siyi-mk32"
            },
            "Firmware": {
                "Type": "",
                "Version": ""
            },
            "Notes": "mk32 COMBO"
        },
        "RC Transmitter": {
            "Product": {
                "Manufacturer": "SIYI",
                "Model": "mk32 RADIO",
                "Version": "1",
                "URL": "https://shop.siyi.biz/products/siyi-mk32"
            },
            "Firmware": {
                "Type": "",
                "Version": ""
            },
            "Notes": "mk32 COMBO"
        },
        "RC Receiver": {
            "Product": {
                "Manufacturer": "SIYI",
                "Model": "mk32 RADIO",
                "Version": "1",
                "URL": "https://shop.siyi.biz/products/siyi-mk32"
            },
            "Firmware": {
                "Type": "",
                "Version": ""
            },
            "FC Connection": {
                "Type": "RCin/SBUS",
                "Protocol": "SBUS"
            },
            "Notes": "MK32 RADIO COMBO"
        },
        "Telemetry": {
            "Product": {
                "Manufacturer": "SIYI",
                "Model": "mk32 RADIO",
                "Version": "",
                "URL": "https://shop.siyi.biz/products/siyi-mk32"
            },
            "Firmware": {
                "Type": "",
                "Version": ""
            },
            "FC Connection": {
                "Type": "SERIAL1",
                "Protocol": "MAVLink2"
            },
            "Notes": "mk32 COMBO RADIO"
        }
    },
    "Program version": "4.5.6",
    "Configuration template": "Hoverit_X11+"
}
