{
    "Format version": 2,
    "Components": {
        "Flight Controller": {
            "Product": {
                "Manufacturer": "Holybro",
                "Model": "Pixhawk6C-bdshot",
                "Version": "1.0",
                "URL": "https://holybro.com/products/pixhawk-6c?srsltid=AfmBOoqx6fEclM8l4wICaZcGtR5ecABosliproB7TozPMEdYY7SG0A_t"
            },
            "Firmware": {
                "Type": "ArduCopter",
                "Version": "4.5.7 official"
            },
            "Specifications": {
                "MCU Series": "STM32H7xx"
            },
            "Notes": "The Pixhawk 6C with dimensions: 84.8 * 44 * 12.4 mm"
        },
        "Frame": {
            "Product": {
                "Manufacturer": "Holybro",
                "Model": "X650 V2",
                "Version": "Payload: 1500g (without Battery, 70% Throttle)",
                "URL": "https://holybro.com/products/x500-v2-kits?srsltid=AfmBOor9p_QpA5CNDhM99OCZ4DMVM1eUJ8H_dLW4FpDZgz0VR01YJ_M8"
            },
            "Specifications": {
                "TOW min Kg": 5.6,
                "TOW max Kg": 7.6,
                "Frame class": "Quad"
            },
            "Notes": "Frame is X650 V2 type. Look on holybro site for more specifications"
        },
        "Battery Monitor": {
            "Product": {
                "Manufacturer": "Holybro",
                "Model": "PM02 V3 Power Module (12S)",
                "Version": "V3",
                "URL": "https://holybro.com/products/pm02-v3-12s-power-module?srsltid=AfmBOoruyyy13wBspPFngCWD-IdOxUHiH3nfgUpN79MuVgugcMqUUxGK"
            },
            "Firmware": {
                "Type": "",
                "Version": ""
            },
            "FC Connection": {
                "Type": "Analog",
                "Protocol": "Analog Voltage and Current"
            },
            "Notes": "Supplies 5.2V to FC, providing current consumption and battery voltage measurements"
        },
        "Battery": {
            "Product": {
                "Manufacturer": "Gens Ace",
                "Model": "Tattu 6S1P 11000mAh",
                "Version": "",
                "URL": ""
            },
            "Specifications": {
                "Chemistry": "LipoHV",
                "Volt per cell max": 4.2,
                "Volt per cell arm": 3.6833,
                "Volt per cell low": 3.4,
                "Volt per cell crit": 3.3,
                "Volt per cell min": 3.3,
                "Number of cells": 6,
                "Capacity mAh": 11000
            },
            "Notes": "Normal battery 1350 g."
        },
        "ESC": {
            "Product": {
                "Manufacturer": "Holybro",
                "Model": "Tekko32 F4-45A",
                "Version": "AM32",
                "URL": "https://holybro.com/products/tekko32-f4-45a-esc"
            },
            "Firmware": {
                "Type": "AM32",
                "Version": ""
            },
            "FC->ESC Connection": {
                "Type": "Main Out",
                "Protocol": "DShot600"
            },
            "ESC->FC Telemetry": {
                "Type": "Main Out",
                "Protocol": "BDShotOnly"
            },
            "Notes": ""
        },
        "Motors": {
            "Product": {
                "Manufacturer": "T-Motor",
                "Model": "MN4014",
                "Version": "KV3330",
                "URL": "https://store.tmotor.com/product/mn4014-kv330-motor-navigator-type.html"
            },
            "Specifications": {
                "Poles": 14
            },
            "Notes": "High thrust and powerful motors"
        },
        "Propellers": {
            "Product": {
                "Manufacturer": "GEMFAN",
                "Model": "1555 carbon fiber",
                "Version": "",
                "URL": ""
            },
            "Specifications": {
                "Diameter_inches": 15.5
            },
            "Notes": ""
        },
        "GNSS Receiver": {
            "Product": {
                "Manufacturer": "Holybro",
                "Model": "M10",
                "Version": "1",
                "URL": "https://holybro.com/products/m10-gps?srsltid=AfmBOootSZi5Pc_2XhliqsKy-u3_8l8SKZ8tzd5wDuPMENtL-ZeLngUL"
            },
            "Firmware": {
                "Type": "Ublox",
                "Version": "M10"
            },
            "FC Connection": {
                "Type": "SERIAL3",
                "Protocol": "uBlox"
            },
            "Notes": "uBlox M10 GNSS"
        },
        "RC Controller": {
            "Product": {
                "Manufacturer": "MP",
                "Model": "Joystick support",
                "Version": "",
                "URL": "https://ardupilot.org/copter/docs/common-joystick.html"
            },
            "Firmware": {
                "Type": "",
                "Version": ""
            },
            "Notes": ""
        },
        "RC Transmitter": {
            "Product": {
                "Manufacturer": "Microsoft",
                "Model": "X-box One controller",
                "Version": "",
                "URL": "https://www.microsoft.com/store/collections/xboxcontrollers"
            },
            "Firmware": {
                "Type": "",
                "Version": ""
            },
            "Notes": ""
        },
        "RC Receiver": {
            "Product": {
                "Manufacturer": "CUAV",
                "Model": "LTE-Link SE",
                "Version": "",
                "URL": "https://doc.cuav.net/link/lte-link/en/lte-link-se.html"
            },
            "Firmware": {
                "Type": "",
                "Version": ""
            },
            "FC Connection": {
                "Type": "RCin/SBUS",
                "Protocol": "All"
            },
            "Notes": "This receiver is connected to the pixhawk 6C PPM/SBUS RC entrance and uses PPM protocol"
        },
        "Telemetry": {
            "Product": {
                "Manufacturer": "CUAV",
                "Model": "LTE-Link SE",
                "Version": "",
                "URL": "https://doc.cuav.net/link/lte-link/en/lte-link-se.html"
            },
            "Firmware": {
                "Type": "",
                "Version": ""
            },
            "FC Connection": {
                "Type": "SERIAL1",
                "Protocol": "MAVLink2"
            },
            "Notes": ""
        }
    },
    "Program version": "5.0.1",
    "Configuration template": "Holybro_X500_V2"
}
