{
    "Format version": 2,
    "Components": {
        "Flight Controller": {
            "Product": {
                "Manufacturer": "ArduPilot",
                "Model": "SITL",
                "Version": "-",
                "URL": "-"
            },
            "Firmware": {
                "Type": "ArduCopter",
                "Version": "4.6.0 dev"
            },
            "Specifications": {
                "MCU Series": "Unknown"
            },
            "Notes": "This is iris drone with a gimbal attached, works like a servo joint. All other sensors and actuators are plugins that work in gazebo."
        },
        "Frame": {
            "Product": {
                "Manufacturer": "Gazebo",
                "Model": "iris_with_gimbal",
                "Version": "-",
                "URL": "-"
            },
            "Specifications": {
                "TOW min Kg": 0.6,
                "TOW max Kg": 0.6,
                "Frame class": "Quad"
            },
            "Notes": "TOW in this case a taken ideal, and not calculated including gimbal."
        },
        "Battery Monitor": {
            "Product": {
                "Manufacturer": "ArduPilot",
                "Model": "SITL",
                "Version": "4.6.x",
                "URL": "-"
            },
            "Firmware": {
                "Type": "",
                "Version": ""
            },
            "FC Connection": {
                "Type": "Analog",
                "Protocol": "Analog Voltage and Current"
            },
            "Notes": ""
        },
        "Battery": {
            "Product": {
                "Manufacturer": "ArduPilot",
                "Model": "SITL",
                "Version": "4.6.x",
                "URL": "-"
            },
            "Specifications": {
                "Chemistry": "LipoHV",
                "Volt per cell max": 4.2667,
                "Volt per cell arm": 3.925,
                "Volt per cell low": 3.6,
                "Volt per cell crit": 3.55,
                "Volt per cell min": 3.2,
                "Number of cells": 3,
                "Capacity mAh": 1800
            },
            "Notes": "A Simulated battery"
        },
        "ESC": {
            "Product": {
                "Manufacturer": "ArduPilot",
                "Model": "SITL",
                "Version": "4.6.x",
                "URL": "-"
            },
            "Firmware": {
                "Type": "-",
                "Version": "-"
            },
            "FC->ESC Connection": {
                "Type": "Main Out",
                "Protocol": "Normal"
            },
            "ESC->FC Telemetry": {
                "Type": "None",
                "Protocol": "None"
            },
            "Notes": ""
        },
        "Motors": {
            "Product": {
                "Manufacturer": "ArduPilot",
                "Model": "gz-sim-apply-joint-force-system",
                "Version": "-",
                "URL": "-"
            },
            "Specifications": {
                "Poles": 3
            },
            "Notes": ""
        },
        "Propellers": {
            "Product": {
                "Manufacturer": "ArduPilot",
                "Model": "gz-sim-apply-joint-force-system",
                "Version": "-",
                "URL": "-"
            },
            "Specifications": {
                "Diameter_inches": 3
            },
            "Notes": ""
        },
        "GNSS Receiver": {
            "Product": {
                "Manufacturer": "ArduPilot",
                "Model": "SITL",
                "Version": "4.6.x",
                "URL": "-"
            },
            "Firmware": {
                "Type": "",
                "Version": ""
            },
            "FC Connection": {
                "Type": "SERIAL3",
                "Protocol": "uBlox"
            },
            "Notes": "-"
        },
        "RC Controller": {
            "Product": {
                "Manufacturer": "-",
                "Model": "-",
                "Version": "-",
                "URL": "-"
            },
            "Firmware": {
                "Type": "-",
                "Version": "-"
            },
            "Notes": ""
        },
        "RC Transmitter": {
            "Product": {
                "Manufacturer": "-",
                "Model": "-",
                "Version": "-",
                "URL": "-"
            },
            "Firmware": {
                "Type": "-",
                "Version": "-"
            },
            "Notes": "-"
        },
        "RC Receiver": {
            "Product": {
                "Manufacturer": "-",
                "Model": "-",
                "Version": "",
                "URL": "-"
            },
            "Firmware": {
                "Type": "-",
                "Version": "-"
            },
            "FC Connection": {
                "Type": "RCin/SBUS",
                "Protocol": "All"
            },
            "Notes": ""
        },
        "Telemetry": {
            "Product": {
                "Manufacturer": "ArduPilot",
                "Model": "SITL",
                "Version": "4.6.x",
                "URL": ""
            },
            "Firmware": {
                "Type": "",
                "Version": ""
            },
            "FC Connection": {
                "Type": "SERIAL1",
                "Protocol": "MAVLink2"
            },
            "Notes": ""
        }
    },
    "Program version": "4.5.8",
    "Configuration template": "4.5.x-params"
}
